Enter password: ***********
Welcome to the MySQL monitor.  Commands end with ; or \g.
Your MySQL connection id is 28
Server version: 8.0.41 MySQL Community Server - GPL

Copyright (c) 2000, 2025, Oracle and/or its affiliates.

Oracle is a registered trademark of Oracle Corporation and/or its
affiliates. Other names may be trademarks of their respective
owners.

Type 'help;' or '\h' for help. Type '\c' to clear the current input statement.

mysql> use firstBit
Database changed
mysql> show table
    -> ;
ERROR 1064 (42000): You have an error in your SQL syntax; check the manual that corresponds to your MySQL server version for the right syntax to use near '' at line 1
mysql> show tables;
+--------------------+
| Tables_in_firstbit |
+--------------------+
| book               |
| country            |
| department         |
| employee           |
| employees          |
| job                |
| job_histry         |
| jobs               |
| lib_issue          |
| member             |
| student            |
+--------------------+
11 rows in set (0.08 sec)

mysql> select*from book;
Empty set (0.00 sec)

mysql> select*from book1;
ERROR 1146 (42S02): Table 'firstbit.book1' doesn't exist
mysql> desc book;
+-------------+--------------+------+-----+---------+-------+
| Field       | Type         | Null | Key | Default | Extra |
+-------------+--------------+------+-----+---------+-------+
| book_no     | int          | YES  |     | NULL    |       |
| book_name   | varchar(30)  | YES  |     | NULL    |       |
| author_name | varchar(30)  | YES  |     | NULL    |       |
| cost        | decimal(7,2) | YES  |     | NULL    |       |
| category    | char(10)     | YES  |     | NULL    |       |
+-------------+--------------+------+-----+---------+-------+
5 rows in set (0.02 sec)

mysql> insert into book values(101,"let us c","denis ritche",450);
ERROR 1136 (21S01): Column count doesn't match value count at row 1
mysql> insert into book values(101,"let us c","denis ritche",450,"system");
Query OK, 1 row affected (0.01 sec)

mysql> insert into book values(102,"oracle-complete ref","loni",550,"database");
Query OK, 1 row affected (0.01 sec)

mysql> insert into book values(103,"mastring sql","loni",250,"database");
Query OK, 1 row affected (0.00 sec)

mysql> insert into book values(104,"pl-sql-ref","scott urman",750,"database");
Query OK, 1 row affected (0.01 sec)

mysql> table book;
+---------+---------------------+--------------+--------+----------+
| book_no | book_name           | author_name  | cost   | category |
+---------+---------------------+--------------+--------+----------+
|     101 | let us c            | denis ritche | 450.00 | system   |
|     102 | oracle-complete ref | loni         | 550.00 | database |
|     103 | mastring sql        | loni         | 250.00 | database |
|     104 | pl-sql-ref          | scott urman  | 750.00 | database |
+---------+---------------------+--------------+--------+----------+
4 rows in set (0.00 sec)

mysql> select*from member;
+-----------+--------------------+----------------+---------------+-----------------+----------+------------------+----------------+
| member_id | member_name        | member_address | acc_open_date | membership_type | fee_paid | max_book_allowed | penalty_amount |
+-----------+--------------------+----------------+---------------+-----------------+----------+------------------+----------------+
|         1 | vijeta badakh      | pune           | 2010-12-05    | lifetime        |    25000 |                5 |          50.00 |
|         2 | nikita badakh      | solapur        | 2020-12-05    | annual          |    10000 |                5 |          50.00 |
|         3 | kirti badakh       | kolhapur       | 2020-08-05    | half yearly     |    23000 |                8 |          40.00 |
|         4 | krutika jagadale   | nashik         | 2025-09-25    | quarterly       |    22000 |                6 |          50.00 |
|         5 | vaishanavi pathare | mumbai         | 2025-09-22    | lifetime        |     2000 |                5 |          60.00 |
|         6 | manjiri chinade    | delhi          | 2025-08-22    | lifetime        |     3000 |                5 |          60.00 |
+-----------+--------------------+----------------+---------------+-----------------+----------+------------------+----------------+
6 rows in set (0.00 sec)

mysql> select *from issue;
ERROR 1146 (42S02): Table 'firstbit.issue' doesn't exist
mysql> select *from lib_issue;
Empty set (0.01 sec)

mysql> desc lib_issue;
+--------------+------+------+-----+---------+-------+
| Field        | Type | Null | Key | Default | Extra |
+--------------+------+------+-----+---------+-------+
| lib_issue_id | int  | YES  |     | NULL    |       |
| book_no      | int  | YES  |     | NULL    |       |
| member_id    | int  | YES  |     | NULL    |       |
| issue_date   | date | YES  |     | NULL    |       |
| return_date  | date | YES  |     | NULL    |       |
+--------------+------+------+-----+---------+-------+
5 rows in set (0.00 sec)

mysql> alter table lib_issue rename to issue;
Query OK, 0 rows affected (0.06 sec)

mysql> desc issue;
+--------------+------+------+-----+---------+-------+
| Field        | Type | Null | Key | Default | Extra |
+--------------+------+------+-----+---------+-------+
| lib_issue_id | int  | YES  |     | NULL    |       |
| book_no      | int  | YES  |     | NULL    |       |
| member_id    | int  | YES  |     | NULL    |       |
| issue_date   | date | YES  |     | NULL    |       |
| return_date  | date | YES  |     | NULL    |       |
+--------------+------+------+-----+---------+-------+
5 rows in set (0.00 sec)

mysql> insert into issue values(7003,104,"2015-01-06",null,null);
ERROR 1265 (01000): Data truncated for column 'member_id' at row 1
mysql> insert into issue values(7003,104,null,"2015-01-06",null);
Query OK, 1 row affected (0.00 sec)
       insert into issue values(7005,104,null,"2014-12-31","2017-03-22");
Query OK, 1 row affected (0.00 sec)

mysql> insert into issue values(7006,105,null,"2018-02-23");
ERROR 1136 (21S01): Column count doesn't match value count at row 1
mysql> insert into issue values(7006,105,null,"2018-02-23",null);
Query OK, 1 row affected (0.00 sec)

mysql> table issue;
+--------------+---------+-----------+------------+-------------+
| lib_issue_id | book_no | member_id | issue_date | return_date |
+--------------+---------+-----------+------------+-------------+
|         7003 |     104 |      NULL | 2015-01-06 | NULL        |
|         7005 |     104 |      NULL | 2014-12-31 | 2017-03-22  |
|         7006 |     105 |      NULL | 2018-02-23 | NULL        |
+--------------+---------+-----------+------------+-------------+
3 rows in set (0.00 sec)

mysql> insert into issue values(7007,106,null,"2020-08-23","2021-03-22");
Query OK, 1 row affected (0.00 sec)

mysql> table issue;
+--------------+---------+-----------+------------+-------------+
| lib_issue_id | book_no | member_id | issue_date | return_date |
+--------------+---------+-----------+------------+-------------+
|         7003 |     104 |      NULL | 2015-01-06 | NULL        |
|         7005 |     104 |      NULL | 2014-12-31 | 2017-03-22  |
|         7006 |     105 |      NULL | 2018-02-23 | NULL        |
|         7007 |     106 |      NULL | 2020-08-23 | 2021-03-22  |
+--------------+---------+-----------+------------+-------------+
4 rows in set (0.00 sec)

mysql> select book_name from book where author_name ="loni";
+---------------------+
| book_name           |
+---------------------+
| oracle-complete ref |
| mastring sql        |
+---------------------+
2 rows in set (0.00 sec)

mysql> select *from book where return_date null;
ERROR 1064 (42000): You have an error in your SQL syntax; check the manual that corresponds to your MySQL server version for the right syntax to use near 'null' at line 1
mysql> select *from book where return_date=null;
ERROR 1054 (42S22): Unknown column 'return_date' in 'where clause'
mysql> select *from book where return_date is not null;
ERROR 1054 (42S22): Unknown column 'return_date' in 'where clause'
mysql> select *from issue where return_date is null;
+--------------+---------+-----------+------------+-------------+
| lib_issue_id | book_no | member_id | issue_date | return_date |
+--------------+---------+-----------+------------+-------------+
|         7003 |     104 |      NULL | 2015-01-06 | NULL        |
|         7006 |     105 |      NULL | 2018-02-23 | NULL        |
+--------------+---------+-----------+------------+-------------+
2 rows in set (0.00 sec)

mysql> upadate issue set return_date ="2006-12-31" where return_date is null and lib_issue_id not in(7005,7007);
ERROR 1064 (42000): You have an error in your SQL syntax; check the manual that corresponds to your MySQL server version for the right syntax to use near 'upadate issue set return_date ="2006-12-31" where return_date is null and lib_is' at line 1
mysql> update issue set return_date ="2006-12-31" where return_date is null and lib_issue_id not in(7005,7007);;
Query OK, 2 rows affected (0.01 sec)
Rows matched: 2  Changed: 2  Warnings: 0

ERROR:
No query specified

mysql> select*from issue;
+--------------+---------+-----------+------------+-------------+
| lib_issue_id | book_no | member_id | issue_date | return_date |
+--------------+---------+-----------+------------+-------------+
|         7003 |     104 |      NULL | 2015-01-06 | 2006-12-31  |
|         7005 |     104 |      NULL | 2014-12-31 | 2017-03-22  |
|         7006 |     105 |      NULL | 2018-02-23 | 2006-12-31  |
|         7007 |     106 |      NULL | 2020-08-23 | 2021-03-22  |
+--------------+---------+-----------+------------+-------------+
4 rows in set (0.00 sec)

mysql> select*from book where retrun_date is null and datediff(curdate(),issue_date)>30;
ERROR 1054 (42S22): Unknown column 'retrun_date' in 'where clause'
mysql> select*from issue where retrun_date is null and datediff(curdate(),issue_date)>30;
ERROR 1054 (42S22): Unknown column 'retrun_date' in 'where clause'
mysql> select*from issue where return_date is null and datediff(curdate(),issue_date)>30;
Empty set (0.00 sec)

mysql> SELECT* from book where cost between(500,750) and category="database";
ERROR 1241 (21000): Operand should contain 1 column(s)
mysql> SELECT* from book where cost betweein(500,750) and category="database";
ERROR 1064 (42000): You have an error in your SQL syntax; check the manual that corresponds to your MySQL server version for the right syntax to use near 'betweeinSELECT* from book where cost between(500,750) and category="database";;
ERROR 1241 (21000): Operand should contain 1 column(s)
ERROR:
No query specified

mysql> SELECT* from book where cost between(500,750) and category="database";
ERROR 1241 (21000): Operand should contain 1 column(s)
mysql> SELECT* from book where cost between 500 and 750 and category="database";
+---------+---------------------+-------------+--------+----------+
| book_no | book_name           | author_name | cost   | category |
+---------+---------------------+-------------+--------+----------+
|     102 | oracle-complete ref | loni        | 550.00 | database |
|     104 | pl-sql-ref          | scott urman | 750.00 | database |
+---------+---------------------+-------------+--------+----------+
2 rows in set (0.00 sec)

mysql> select* from book where category in("database","finction","management");
+---------+---------------------+-------------+--------+----------+
| book_no | book_name           | author_name | cost   | category |
+---------+---------------------+-------------+--------+----------+
|     102 | oracle-complete ref | loni        | 550.00 | database |
|     103 | mastring sql        | loni        | 250.00 | database |
|     104 | pl-sql-ref          | scott urman | 750.00 | database |
+---------+---------------------+-------------+--------+----------+
3 rows in set (0.00 sec)

mysql> select*from member;
+-----------+--------------------+----------------+---------------+-----------------+----------+------------------+----------------+
| member_id | member_name        | member_address | acc_open_date | membership_type | fee_paid | max_book_allowed | penalty_amount |
+-----------+--------------------+----------------+---------------+-----------------+----------+------------------+----------------+
|         1 | vijeta badakh      | pune           | 2010-12-05    | lifetime        |    25000 |                5 |          50.00 |
|         2 | nikita badakh      | solapur        | 2020-12-05    | annual          |    10000 |                5 |          50.00 |
|         3 | kirti badakh       | kolhapur       | 2020-08-05    | half yearly     |    23000 |                8 |          40.00 |
|         4 | krutika jagadale   | nashik         | 2025-09-25    | quarterly       |    22000 |                6 |          50.00 |
|         5 | vaishanavi pathare | mumbai         | 2025-09-22    | lifetime        |     2000 |                5 |          60.00 |
|         6 | manjiri chinade    | delhi          | 2025-08-22    | lifetime        |     3000 |                5 |          60.00 |
+-----------+--------------------+----------------+---------------+-----------------+----------+------------------+----------------+
6 rows in set (0.00 sec)

mysql> select*from member where penalty_amount order by desc;
ERROR 1064 (42000): You have an error in your SQL syntax; check the manual that corresponds to your MySQL server version for the right syntax to use near 'desc' at line 1
mysql> select*from member order by penalty_amount desc;
+-----------+--------------------+----------------+---------------+-----------------+----------+------------------+----------------+
| member_id | member_name        | member_address | acc_open_date | membership_type | fee_paid | max_book_allowed | penalty_amount |
+-----------+--------------------+----------------+---------------+-----------------+----------+------------------+----------------+
|         5 | vaishanavi pathare | mumbai         | 2025-09-22    | lifetime        |     2000 |                5 |          60.00 |
|         6 | manjiri chinade    | delhi          | 2025-08-22    | lifetime        |     3000 |                5 |          60.00 |
|         1 | vijeta badakh      | pune           | 2010-12-05    | lifetime        |    25000 |                5 |          50.00 |
|         2 | nikita badakh      | solapur        | 2020-12-05    | annual          |    10000 |                5 |          50.00 |
|         4 | krutika jagadale   | nashik         | 2025-09-25    | quarterly       |    22000 |                6 |          50.00 |
|         3 | kirti badakh       | kolhapur       | 2020-08-05    | half yearly     |    23000 |                8 |          40.00 |
+-----------+--------------------+----------------+---------------+-----------------+----------+------------------+----------------+
6 rows in set (0.00 sec)

mysql> alter table book
    -> ;
Query OK, 0 rows affected (0.01 sec)

mysql> update book set cost=300 and category="RDBMS" where book_no=103;
Query OK, 1 row affected (0.01 sec)
Rows matched: 1  Changed: 1  Warnings: 0

mysql> select*from book;
+---------+---------------------+--------------+--------+----------+
| book_no | book_name           | author_name  | cost   | category |
+---------+---------------------+--------------+--------+----------+
|     101 | let us c            | denis ritche | 450.00 | system   |
|     102 | oracle-complete ref | loni         | 550.00 | database |
|     103 | mastring sql        | loni         |   0.00 | database |
|     104 | pl-sql-ref          | scott urman  | 750.00 | database |
+---------+---------------------+--------------+--------+----------+
4 rows in set (0.00 sec)

mysql> update book set cost=300,category="RDBMS" where book_no=103;
Query OK, 1 row affected (0.01 sec)
Rows matched: 1  Changed: 1  Warnings: 0

mysql> select*from book;
+---------+---------------------+--------------+--------+----------+
| book_no | book_name           | author_name  | cost   | category |
+---------+---------------------+--------------+--------+----------+
|     101 | let us c            | denis ritche | 450.00 | system   |
|     102 | oracle-complete ref | loni         | 550.00 | database |
|     103 | mastring sql        | loni         | 300.00 | RDBMS    |
|     104 | pl-sql-ref          | scott urman  | 750.00 | database |
+---------+---------------------+--------------+--------+----------+
4 rows in set (0.00 sec)

mysql> select*from book order by category and order by cost desc;
ERROR 1064 (42000): You have an error in your SQL syntax; check the manual that corresponds to your MySQL server version for the right syntax to use near 'order by cost desc' at line 1
mysql> select*from book order by category,order by cost desc;
ERROR 1064 (42000): You have an error in your SQL syntax; check the manual that corresponds to your MySQL server version for the right syntax to use near 'order by cost desc' at line 1
mysql> select*from book order by category,cost desc;
+---------+---------------------+--------------+--------+----------+
| book_no | book_name           | author_name  | cost   | category |
+---------+---------------------+--------------+--------+----------+
|     104 | pl-sql-ref          | scott urman  | 750.00 | database |
|     102 | oracle-complete ref | loni         | 550.00 | database |
|     103 | mastring sql        | loni         | 300.00 | RDBMS    |
|     101 | let us c            | denis ritche | 450.00 | system   |
+---------+---------------------+--------------+--------+----------+
4 rows in set (0.00 sec)

mysql> select*from book where book_name like "%sql%";
+---------+--------------+-------------+--------+----------+
| book_no | book_name    | author_name | cost   | category |
+---------+--------------+-------------+--------+----------+
|     103 | mastring sql | loni        | 300.00 | RDBMS    |
|     104 | pl-sql-ref   | scott urman | 750.00 | database |
+---------+--------------+-------------+--------+----------+
2 rows in set (0.00 sec)

mysql> select lib_issue_id,issue_date,return_date datediff(return_date,issue_date) as no_of_days from issue;
ERROR 1064 (42000): You have an error in your SQL syntax; check the manual that corresponds to your MySQL server version for the right syntax to use near '(return_date,issue_date) as no_of_days from issue' at line 1
mysql> select lib_issue_id,issue_date,return_date, datediff(return_date,issue_date) as no_of_days from issue;
+--------------+------------+-------------+------------+
| lib_issue_id | issue_date | return_date | no_of_days |
+--------------+------------+-------------+------------+
|         7003 | 2015-01-06 | 2006-12-31  |      -2928 |
|         7005 | 2014-12-31 | 2017-03-22  |        812 |
|         7006 | 2018-02-23 | 2006-12-31  |      -4072 |
|         7007 | 2020-08-23 | 2021-03-22  |        211 |
+--------------+------------+-------------+------------+
4 rows in set (0.00 sec)

mysql> select*from member;
+-----------+--------------------+----------------+---------------+-----------------+----------+------------------+----------------+
| member_id | member_name        | member_address | acc_open_date | membership_type | fee_paid | max_book_allowed | penalty_amount |
+-----------+--------------------+----------------+---------------+-----------------+----------+------------------+----------------+
|         1 | vijeta badakh      | pune           | 2010-12-05    | lifetime        |    25000 |                5 |          50.00 |
|         2 | nikita badakh      | solapur        | 2020-12-05    | annual          |    10000 |                5 |          50.00 |
|         3 | kirti badakh       | kolhapur       | 2020-08-05    | half yearly     |    23000 |                8 |          40.00 |
|         4 | krutika jagadale   | nashik         | 2025-09-25    | quarterly       |    22000 |                6 |          50.00 |
|         5 | vaishanavi pathare | mumbai         | 2025-09-22    | lifetime        |     2000 |                5 |          60.00 |
|         6 | manjiri chinade    | delhi          | 2025-08-22    | lifetime        |     3000 |                5 |          60.00 |
+-----------+--------------------+----------------+---------------+-----------------+----------+------------------+----------------+
6 rows in set (0.00 sec)

mysql> select* from member order by acc_open_date;
+-----------+--------------------+----------------+---------------+-----------------+----------+------------------+----------------+
| member_id | member_name        | member_address | acc_open_date | membership_type | fee_paid | max_book_allowed | penalty_amount |
+-----------+--------------------+----------------+---------------+-----------------+----------+------------------+----------------+
|         1 | vijeta badakh      | pune           | 2010-12-05    | lifetime        |    25000 |                5 |          50.00 |
|         3 | kirti badakh       | kolhapur       | 2020-08-05    | half yearly     |    23000 |                8 |          40.00 |
|         2 | nikita badakh      | solapur        | 2020-12-05    | annual          |    10000 |                5 |          50.00 |
|         6 | manjiri chinade    | delhi          | 2025-08-22    | lifetime        |     3000 |                5 |          60.00 |
|         5 | vaishanavi pathare | mumbai         | 2025-09-22    | lifetime        |     2000 |                5 |          60.00 |
|         4 | krutika jagadale   | nashik         | 2025-09-25    | quarterly       |    22000 |                6 |          50.00 |
+-----------+--------------------+----------------+---------------+-----------------+----------+------------------+----------------+
6 rows in set (0.00 sec)

mysql> select count(*) as total_no_book from issue where member_id=1;
+---------------+
| total_no_book |
+---------------+
|             0 |
+---------------+
1 row in set (0.01 sec)

mysql> select sum(penalty_amount) from member;
+---------------------+
| sum(penalty_amount) |
+---------------------+
|              310.00 |
+---------------------+
1 row in set (0.00 sec)

mysql> select sum(member_id) from member;
+----------------+
| sum(member_id) |
+----------------+
|             21 |
+----------------+
1 row in set (0.00 sec)

mysql> select total(member_id) from member;
ERROR 1305 (42000): FUNCTION firstbit.total does not exist
mysql> select count(*) as total_member from member;
+--------------+
| total_member |
+--------------+
|            6 |
+--------------+
1 row in set (0.01 sec)

mysql> select count(*) total_no_issued from issue;
+-----------------+
| total_no_issued |
+-----------------+
|               4 |
+-----------------+
1 row in set (0.00 sec)

mysql> select avg(fee_paid) from member;
+---------------+
| avg(fee_paid) |
+---------------+
|    14166.6667 |
+---------------+
1 row in set (0.00 sec)

mysql> select count(*),category from book;
ERROR 1140 (42000): In aggregated query without GROUP BY, expression #2 of SELECT list contains nonaggregated column 'firstbit.book.category'; this is incompatible with sql_mode=only_full_group_by
mysql> ^C
mysql> select count(*),category from book order by category;
ERROR 1140 (42000): In aggregated query without GROUP BY, expression #2 of SELECT list contains nonaggregated column 'firstbit.book.category'; this is incompatible with sql_mode=only_full_group_by
mysql> select category,count(*) from book order by category;
ERROR 1140 (42000): In aggregated query without GROUP BY, expression #1 of SELECT list contains nonaggregated column 'firstbit.book.category'; this is incompatible with sql_mode=only_full_group_by
mysql> select category,count(*) from book group by category;
+----------+----------+
| category | count(*) |
+----------+----------+
| system   |        1 |
| database |        2 |
| RDBMS    |        1 |
+----------+----------+
3 rows in set (0.00 sec)

mysql> select count(*),book_no from from issue group by book_no order by count(*) desc;
ERROR 1064 (42000): You have an error in your SQL syntax; check the manual that corresponds to your MySQL server version for the right syntax to use near 'from issue group by book_no order by count(*) desc' at line 1
mysql> select count(*),lib_issue_id from from issue group by book_no order by count(*) desc;
ERROR 1064 (42000): You have an error in your SQL syntax; check the manual that corresponds to your MySQL server version for the right syntax to use near 'from issue group by book_no order by count(*) desc' at line 1
mysql> select count(*),lib_issue_id from issue group by book_no order by count(*) desc;
ERROR 1055 (42000): Expression #2 of SELECT list is not in GROUP BY clause and contains nonaggregated column 'firstbit.issue.lib_issue_id' which is not functionally dependent on columns in GROUP BY clause; this is incompatible with sql_mode=only_full_group_by
mysql> select ib_issue_id,count(*) from issue group by book_no order by count(*) desc;
ERROR 1054 (42S22): Unknown column 'ib_issue_id' in 'field list'
mysql> select book_no,count(*) from issue group by book_no order by count(*) desc;
+---------+----------+
| book_no | count(*) |
+---------+----------+
|     104 |        2 |
|     105 |        1 |
|     106 |        1 |
+---------+----------+
3 rows in set (0.00 sec)

mysql> select*from book;
+---------+---------------------+--------------+--------+----------+
| book_no | book_name           | author_name  | cost   | category |
+---------+---------------------+--------------+--------+----------+
|     101 | let us c            | denis ritche | 450.00 | system   |
|     102 | oracle-complete ref | loni         | 550.00 | database |
|     103 | mastring sql        | loni         | 300.00 | RDBMS    |
|     104 | pl-sql-ref          | scott urman  | 750.00 | database |
+---------+---------------------+--------------+--------+----------+
4 rows in set (0.00 sec)

mysql> show create table book;
+-------+---------------------------------------------------------------------------------------------------------------------------------------------------------------------------------------------------------------------------------------------------------------------------------+
| Table | Create Table                                                                                                                                                                                                                                                                    |
+-------+---------------------------------------------------------------------------------------------------------------------------------------------------------------------------------------------------------------------------------------------------------------------------------+
| book  | CREATE TABLE `book` (
  `book_no` int DEFAULT NULL,
  `book_name` varchar(30) DEFAULT NULL,
  `author_name` varchar(30) DEFAULT NULL,
  `cost` decimal(7,2) DEFAULT NULL,
  `category` char(10) DEFAULT NULL
) ENGINE=InnoDB DEFAULT CHARSET=utf8mb4 COLLATE=utf8mb4_0900_ai_ci |
+-------+---------------------------------------------------------------------------------------------------------------------------------------------------------------------------------------------------------------------------------------------------------------------------------+
1 row in set (0.00 sec)

mysql> show create table issue;
+-------+----------------------------------------------------------------------------------------------------------------------------------------------------------------------------------------------------------------------------------------------------------------+
| Table | Create Table                                                                                                                                                                                                                                                   |
+-------+----------------------------------------------------------------------------------------------------------------------------------------------------------------------------------------------------------------------------------------------------------------+
| issue | CREATE TABLE `issue` (
  `lib_issue_id` int DEFAULT NULL,
  `book_no` int DEFAULT NULL,
  `member_id` int DEFAULT NULL,
  `issue_date` date DEFAULT NULL,
  `return_date` date DEFAULT NULL
) ENGINE=InnoDB DEFAULT CHARSET=utf8mb4 COLLATE=utf8mb4_0900_ai_ci |
+-------+----------------------------------------------------------------------------------------------------------------------------------------------------------------------------------------------------------------------------------------------------------------+
1 row in set (0.00 sec)

mysql> select*from issue;
+--------------+---------+-----------+------------+-------------+
| lib_issue_id | book_no | member_id | issue_date | return_date |
+--------------+---------+-----------+------------+-------------+
|         7003 |     104 |      NULL | 2015-01-06 | 2006-12-31  |
|         7005 |     104 |      NULL | 2014-12-31 | 2017-03-22  |
|         7006 |     105 |      NULL | 2018-02-23 | 2006-12-31  |
|         7007 |     106 |      NULL | 2020-08-23 | 2021-03-22  |
+--------------+---------+-----------+------------+-------------+
4 rows in set (0.00 sec)

mysql> select max(penalty_amount),min(penalty_amount),sum(penalty_amount),avg(penalty_amount) from member;
+---------------------+---------------------+---------------------+---------------------+
| max(penalty_amount) | min(penalty_amount) | sum(penalty_amount) | avg(penalty_amount) |
+---------------------+---------------------+---------------------+---------------------+
|               60.00 |               40.00 |              310.00 |           51.666667 |
+---------------------+---------------------+---------------------+---------------------+
1 row in set (0.00 sec)

mysql> select member_id , book_no,count(*) from member gruop by member_id having count(*)>2;
ERROR 1064 (42000): You have an error in your SQL syntax; check the manual that corresponds to your MySQL server version for the right syntax to use near 'by member_id having count(*)>2' at line 1
mysql> select member_id,count(*) from member gruop by member_id having count(*)>2;
ERROR 1064 (42000): You have an error in your SQL syntax; check the manual that corresponds to your MySQL server version for the right syntax to use near 'by member_id having count(*)>2' at line 1
mysql> select member_id,count(*) from issue gruop by member_id having count(*)>2;
ERROR 1064 (42000): You have an error in your SQL syntax; check the manual that corresponds to your MySQL server version for the right syntax to use near 'by member_id having count(*)>2' at line 1
mysql> SELECT member_id, COUNT(*) AS no_of_books
    -> FROM Issue
    -> GROUP BY member_id
    -> HAVING COUNT(*) > 2;
+-----------+-------------+
| member_id | no_of_books |
+-----------+-------------+
|      NULL |           4 |
+-----------+-------------+
1 row in set (0.00 sec)

mysql> select member_id,count(*) from issue gruop by member_id having count(*)>2;
ERROR 1064 (42000): You have an error in your SQL syntax; check the manual that corresponds to your MySQL server version for the right syntax to use near 'by member_id having count(*)>2' at line 1
mysql> select member_id,count(*) from issue group by member_id having count(*)>2;
+-----------+----------+
| member_id | count(*) |
+-----------+----------+
|      NULL |        4 |
+-----------+----------+
1 row in set (0.00 sec)

mysql> select member_id,book_no,count(*) from issue group by member_id,book_no order by count(*) desc;
+-----------+---------+----------+
| member_id | book_no | count(*) |
+-----------+---------+----------+
|      NULL |     104 |        2 |
|      NULL |     105 |        1 |
|      NULL |     106 |        1 |
+-----------+---------+----------+
3 rows in set (0.00 sec)

mysql> select month(issue_date) count(*) from issue group by month(issue_date) order by count(*) desc;
ERROR 1064 (42000): You have an error in your SQL syntax; check the manual that corresponds to your MySQL server version for the right syntax to use near 'count(*) from issue group by month(issue_date) order by count(*) desc' at line 1
mysql> select month(issue_date) ,count(*) from issue group by month(issue_date) order by count(*) desc;
+-------------------+----------+
| month(issue_date) | count(*) |
+-------------------+----------+
|                 1 |        1 |
|                12 |        1 |
|                 2 |        1 |
|                 8 |        1 |
+-------------------+----------+
4 rows in set (0.00 sec)

mysql> select count(*) from issue group by count(*) having ^C
mysql> select count(*) from issue group by count(*) having book_no is not null;
ERROR 1056 (42000): Can't group on 'count(*)'
mysql> select book_no from issue group by book_no having book_no is not null;
+---------+
| book_no |
+---------+
|     104 |
|     105 |
|     106 |
+---------+
3 rows in set (0.00 sec)

mysql> select member_id from member m
    -> where (select*from issue i where i.member_id=m.member_id);
ERROR 1241 (21000): Operand should contain 1 column(s)
mysql> select member_id from member m where (select*from issue i where i.member_id=m.member_id);
ERROR 1241 (21000): Operand should contain 1 column(s)
mysql> select DISTINCT member_id from member m where (select*from issue i where i.member_id=m.member_id);
ERROR 1241 (21000): Operand should contain 1 column(s)
mysql> select DISTINCT member_id from member m where (select*from issue i where i.member_id=m.member_id);
ERROR 1241 (21000): Operand should contain 1 column(s)
mysql> select DISTINCT member_id from member m where (select 1 from issue i where i.member_id=m.member_id);
Empty set (0.00 sec)

mysql> select member_id, count(*) from issue group by memner_id order by count(*) limit 1;
ERROR 1054 (42S22): Unknown column 'memner_id' in 'group statement'
mysql> select member_id, count(*) from issue group by member_id order by count(*) limit 1;
+-----------+----------+
| member_id | count(*) |
+-----------+----------+
|      NULL |        4 |
+-----------+----------+
1 row in set (0.00 sec)

mysql> select member_id, count(*) from issue group by member_id order by count(*) asc limit 1;
+-----------+----------+
| member_id | count(*) |
+-----------+----------+
|      NULL |        4 |
+-----------+----------+
1 row in set (0.00 sec)

mysql> select member_id, count(*) from issue group by member_id order by count(*) desc limit 1;
+-----------+----------+
| member_id | count(*) |
+-----------+----------+
|      NULL |        4 |
+-----------+----------+
1 row in set (0.00 sec)

mysql>